{
 "$schema":"https://json-schema.org/draft/2020-12/schema","title":"FeatureRecord","type":"object","additionalProperties":false,
 "required":["schema_version","feature_record_id","experience_id","study_id","session_id","feature_set_version","config_version","aoi_set_version","modality","window","features","quality","source_event_count"],
 "properties":{"schema_version":{"const":"1.0.0"},"feature_record_id":{"type":"string"},"experience_id":{"type":"string"},"study_id":{"type":"string"},"session_id":{"type":"string"},"feature_set_version":{"type":"string"},"config_version":{"type":["string","null"]},"aoi_set_version":{"type":["string","null"]},"modality":{"enum":["gaze_and_non_gaze","non_gaze_only"]},"window":{"type":["object","null"]},"features":{"type":"object"},"quality":{"type":"object","required":["gaze_available","missingness","calibration_status"],"properties":{"gaze_available":{"type":"boolean"},"missingness":{"type":"array","items":{"type":"string"}},"calibration_status":{"type":["string","null"]}}},"source_event_count":{"type":"integer","minimum":0}}
}
