{"schema_version":"1.0.0","feature_record_id":"feat-synthetic-0001","experience_id":"exp-demo-store","study_id":"study-product-evaluation","session_id":"session-synthetic-denied-0001","feature_set_version":"1.0.0","config_version":"1.0.0","aoi_set_version":"1.0.0","modality":"non_gaze_only","window":null,"features":{"interaction.click_count":4,"interaction.scroll_distance_px":780,"survey.completion_ratio":1.0,"timing.time_to_first_interaction_ms":920},"quality":{"gaze_available":false,"missingness":["gaze.permission_denied"],"calibration_status":null},"source_event_count":5}
